<?xml version="1.0" encoding="UTF-8"?> 
<brick xmlns:xsi="http://www.w3.org/2001/XMLSchema-instance"
xsi:schemaLocation="brick.xsd">
	<header>
		<brickname>#MMU</brickname>
		<author>Peter Mueler</author>
		<copyright>Bingen</copyright>
		<licenselist>
			<file>GPL</file>
			<file>GPL</file>
			<file>GPL</file>
		</licenselist>
		<contextlist>
			<context key="cconf">
				<file>saasfdsd</file>
				<file>saasfdsd</file>
				<file>saasfdsd</file>
			</context>
			<context key="pconf">
				<file>saasfdsd</file>
				<file>saasfdsd</file>
				<file>saasfdsd</file>
			</context>
		</contextlist>
		<purpose>     <![CDATA[<code>]]>nicht mehrzeilig<![CDATA[</code>]]></purpose>
		<description><![CDATA[<em>]]>mehrzeilig<![CDATA[</em>]]></description>
		<example>     <![CDATA[<strong>]]>mehrzeilig<![CDATA[</strong>]]></example>
		<categorylist>
		        <category name="1">value</category>
						<category name="2">value</category>
						<category name="3">value</category>
		</categorylist>
		<taglist>
		        <tag name="5">value</tag>
						<tag name="6">value</tag>
						<tag name="7">value</tag>
						<tag name="5">value</tag>
		</taglist>
		<attributelist>
			<attribute name="sdfsd">value</attribute>
			<attribute name="sdfsd">value</attribute>
			<attribute name="sdfsd">value</attribute>
			<attribute name="sdfsd">value</attribute>
		</attributelist>
		
	</header>
	<inputlist>
		<input name="df" maxsections="default 1">
      <categorylist>
			       <category name="df">value</category>
						 <category name="df">value</category>
						 <category name="df">value</category>
			</categorylist>
			<taglist>
				<tag name="6">value</tag>
				<tag name="7">value</tag>
				<tag name="45">value</tag>
				<tag name="33">value</tag>
			</taglist>
			<attributelist>
				<attribute name="g">value</attribute>
				<attribute name="g">value</attribute>
				<attribute name="g">value</attribute>
				<attribute name="g">value</attribute>
			</attributelist>
		</input>
		<input name="aadf" maxsections="default 1">
      <categorylist>
			       <category name="df">value</category>
						 <category name="df">value</category>
						 <category name="df">value</category>
			</categorylist>
			<taglist>
				<tag name="6">value</tag>
				<tag name="7">value</tag>
				<tag name="45">value</tag>
				<tag name="33">value</tag>
			</taglist>all.html
			<attributelist>
				<attribute name="g">value</attribute>
				<attribute name="g">value</attribute>
				<attribute name="g">value</attribute>
				<attribute name="g">value</attribute>
			</attributelist>
		</input>
	</inputlist>
	<outputlist>
    <output name="out1" maxsections="default 1">
			<categorylist>
			       <category name="df">value</category>
						 <category name="df">value</category>
						 <category name="df">value</category>
			</categorylist>
			<taglist>
				<tag name="6">value</tag>
				<tag name="7">value</tag>
				<tag name="45">value</tag>
				<tag name="33">value</tag>
			</taglist>
			<attributelist>
				<attribute name="g">value</attribute>
				<attribute name="g">value</attribute>
				<attribute name="g">value</attribute>
				<attribute name="g">value</attribute>
			</attributelist>
		</output>
		 <output name="out2" maxsections="default 1">
			<categorylist>
			       <category name="df">value</category>
						 <category name="df">value</category>
						 <category name="df">value</category>
			</categorylist>
			<taglist>
				<tag name="6">value</tag>
				<tag name="7">value</tag>
				<tag name="45">value</tag>
				<tag name="33">value</tag>
			</taglist>
			<attributelist>
				<attribute name="g">value</attribute>
				<attribute name="g">value</attribute>
				<attribute name="g">value</attribute>
				<attribute name="g">value</attribute>
			</attributelist>
		</output>
		 <output name="out3" maxsections="default 1">
			<categorylist>
			       <category name="df">value</category>
						 <category name="df">value</category>
						 <category name="df">value</category>
			</categorylist>
			<taglist>
				<tag name="6">value</tag>
				<tag name="7">value</tag>
				<tag name="45">value</tag>
				<tag name="33">value</tag>
			</taglist>
			<attributelist>
				<attribute name="g">value</attribute>
				<attribute name="g">value</attribute>
				<attribute name="g">value</attribute>
				<attribute name="g">value</attribute>
			</attributelist>
		</output>
	</outputlist>
	<instancelist>
	        <instance type="brickname1" alias="name"/>
					<instance type="brickname2" alias="name"/>
					<instance type="brickname3" alias="name"/>
					<instance type="brickname4" alias="name"/>
	</instancelist>
	<aliaslist>
	        <alias from="23" to="123" />
					<alias from="23" to="123" />
					<alias from="23" to="123" />
					<alias from="23" to="123" />
	</aliaslist>
	<wirelist>
	        <wire from="2" to="4" />
					<wire from="2" to="4" />
					<wire from="3" to="45" />
	</wirelist>
	<operationlist>
	        <operation name="mal" parent="brickname435" section="optional" />
					<operation name="xx" parent="brickname435" section="optional" />
					<operation name="yy" parent="brickname45" section="optional" />
					<operation name="zz" parent="brickname33" section="optional" />
	</operationlist>
</brick>
